{"count": 1, "results": [{"_id": "39300376", "pmid": 39300376, "title": "Randomized phase 2 study of valproic acid combined with simvastatin and gemcitabine/nab-paclitaxel-based regimens in untreated metastatic pancreatic adenocarcinoma patients: the VESPA trial study protocol.", "journal": "BMC Cancer", "authors": ["Budillon A", "Leone A", "Passaro E", "Silvestro L", "Foschini F", "Iannelli F", "Roca MS", "Macchini M", "Bruzzese F", "Garcia Bermejo ML", "Rodriguez Garrote M", "Tortora G", "Milella M", "Reni M", "Fuchs C", "Hewitt E", "Kubiak C", "Di Gennaro E", "Giannarelli D", "Avallone A"], "date": "2024-09-19T00:00:00Z", "doi": "10.1186/s12885-024-12936-w", "meta_date_publication": "2024 Sep 19", "meta_volume": "24", "meta_issue": "1", "meta_pages": "1167", "score": 50259.195, "text_hl": "We recently showed capability of @CHEMICAL_Valproic_Acid @CHEMICAL_MESH:D014635 @@@VPA@@@/@<m>CHEMICAL_Simvastatin</m> @CHEMICAL_MESH:D019821 @@@Simvastatin@@@ (SIM) combination to potentiate the antitumor activity of gemcitabine/nab-paclitaxel in vitro and in vivo @<m>DISEASE_Anophthalmia_with_pulmonary_hypoplasia</m> @DISEASE_MESH:C537768 @@@PDAC@@@ preclinical models. ", "citations": {"NLM": "Budillon A, Leone A, Passaro E, Silvestro L, Foschini F, Iannelli F, Roca MS, Macchini M, Bruzzese F, Garcia Bermejo ML, Rodriguez Garrote M, Tortora G, Milella M, Reni M, Fuchs C, Hewitt E, Kubiak C, Di Gennaro E, Giannarelli D, Avallone A. Randomized phase 2 study of valproic acid combined with simvastatin and gemcitabine/nab-paclitaxel-based regimens in untreated metastatic pancreatic adenocarcinoma patients: the VESPA trial study protocol. BMC Cancer. 2024 Sep 19;24(1):1167. PMID: 39300376", "BibTeX": "@article{39300376, title={Randomized phase 2 study of valproic acid combined with simvastatin and gemcitabine/nab-paclitaxel-based regimens in untreated metastatic pancreatic adenocarcinoma patients: the VESPA trial study protocol.}, author={Budillon A and Leone A and Passaro E and Silvestro L and Foschini F and Iannelli F and Roca MS and Macchini M and Bruzzese F and Garcia Bermejo ML and Rodriguez Garrote M and Tortora G and Milella M and Reni M and Fuchs C and Hewitt E and Kubiak C and Di Gennaro E and Giannarelli D and Avallone A}, journal={BMC Cancer}, volume={24}, number={1}, pages={1167}}"}}]}