{"count": 1, "results": [{"_id": "28600474", "pmid": 28600474, "title": "Use of Angiotensin System Inhibitors Is Associated with Immune Activation and Longer Survival in Nonmetastatic Pancreatic Ductal Adenocarcinoma.", "journal": "Clin Cancer Res", "authors": ["Liu H", "Naxerova K", "Pinter M", "Incio J", "Lee H", "Shigeta K", "Ho WW", "Crain JA", "Jacobson A", "Michelakos T", "Dias-Santos D", "Zanconato A", "Hong TS", "Clark JW", "Murphy JE", "Ryan DP", "Deshpande V", "Lillemoe KD", "Fernandez-Del Castillo C", "Downes M", "Evans RM", "Michaelson J", "Ferrone CR", "Boucher Y", "Jain RK"], "date": "2017-10-01T00:00:00Z", "doi": "10.1158/1078-0432.CCR-17-0256", "meta_date_publication": "2017 Oct 1", "meta_volume": "23", "meta_issue": "19", "meta_pages": "5959-5969", "score": 50055.074, "text_hl": "RNA-Seq analysis revealed in @DISEASE_Neoplasms @DISEASE_MESH:D009369 @@@tumors@@@ of ASI users (@<m>CHEMICAL_Lisinopril</m> @CHEMICAL_MESH:D017706 @@@lisinopril@@@) a normalized extracellular matrix, a reduced expression of genes involved in @<m>DISEASE_Carcinoma_Pancreatic_Ductal</m> @DISEASE_MESH:D021441 @@@PDAC@@@ progression (e.g., WNT and Notch signaling), and an increased expression of genes linked with the activity of T cells and antigen-presenting cells. ", "citations": {"NLM": "Liu H, Naxerova K, Pinter M, Incio J, Lee H, Shigeta K, Ho WW, Crain JA, Jacobson A, Michelakos T, Dias-Santos D, Zanconato A, Hong TS, Clark JW, Murphy JE, Ryan DP, Deshpande V, Lillemoe KD, Fernandez-Del Castillo C, Downes M, Evans RM, Michaelson J, Ferrone CR, Boucher Y, Jain RK. Use of Angiotensin System Inhibitors Is Associated with Immune Activation and Longer Survival in Nonmetastatic Pancreatic Ductal Adenocarcinoma. Clin Cancer Res. 2017 Oct 1;23(19):5959-5969. PMID: 28600474", "BibTeX": "@article{28600474, title={Use of Angiotensin System Inhibitors Is Associated with Immune Activation and Longer Survival in Nonmetastatic Pancreatic Ductal Adenocarcinoma.}, author={Liu H and Naxerova K and Pinter M and Incio J and Lee H and Shigeta K and Ho WW and Crain JA and Jacobson A and Michelakos T and Dias-Santos D and Zanconato A and Hong TS and Clark JW and Murphy JE and Ryan DP and Deshpande V and Lillemoe KD and Fernandez-Del Castillo C and Downes M and Evans RM and Michaelson J and Ferrone CR and Boucher Y and Jain RK}, journal={Clin Cancer Res}, volume={23}, number={19}, pages={5959-5969}}"}}]}