{"count": 1, "results": [{"_id": "37021189", "pmid": 37021189, "pmcid": "PMC10069218", "title": "The EffecTs of Amlodipine and other Blood PREssure Lowering Agents on Microvascular FuncTion in Small Vessel Diseases (TREAT-SVDs) trial: Study protocol for a randomised crossover trial", "journal": "Eur Stroke J", "authors": ["Kopczak A", "S Stringer M", "van den Brink H", "Kerkhofs D", "W Blair G", "van Dinther M", "Onkenhout L", "A Wartolowska K", "Thrippleton MJ", "Duering M", "Staals J", "Middeke M", "André E", "Norrving B", "Bousser MG", "Mansmann U", "Rothwell PM", "N Doubal F", "van Oostenbrugge R", "Jan Biessels G", "Webb AJ", "Wardlaw JM", "Dichgans M"], "date": "2023-03-01T00:00:00Z", "doi": "10.1177/23969873221143570", "meta_date_publication": "2023 Mar", "meta_volume": "8", "meta_issue": "1", "meta_pages": "387-397", "score": 50274.7, "text_hl": "To test whether @CHEMICAL_Amlodipine @CHEMICAL_MESH:D017311 @@@amlodipine@@@ has a beneficial effect on microvascular function when compared to either @CHEMICAL_Losartan @CHEMICAL_MESH:D019808 @@@losartan@@@ or @<m>CHEMICAL_Atenolol</m> @CHEMICAL_MESH:D001262 @@@atenolol@@@, and whether @CHEMICAL_Losartan @CHEMICAL_MESH:D019808 @@@losartan@@@ has a beneficial effect when compared to @<m>CHEMICAL_Atenolol</m> @CHEMICAL_MESH:D001262 @@@atenolol@@@ in @SPECIES_9606 @@@patients@@@ with symptomatic @<m>DISEASE_Cerebral_Small_Vessel_Diseases</m> @DISEASE_MESH:D059345 @@@SVDs@@@.", "citations": {"NLM": "Kopczak A, S Stringer M, van den Brink H, Kerkhofs D, W Blair G, van Dinther M, Onkenhout L, A Wartolowska K, Thrippleton MJ, Duering M, Staals J, Middeke M, André E, Norrving B, Bousser MG, Mansmann U, Rothwell PM, N Doubal F, van Oostenbrugge R, Jan Biessels G, Webb AJ, Wardlaw JM, Dichgans M. The EffecTs of Amlodipine and other Blood PREssure Lowering Agents on Microvascular FuncTion in Small Vessel Diseases (TREAT-SVDs) trial: Study protocol for a randomised crossover trial Eur Stroke J. 2023 Mar;8(1):387-397. PMID: 37021189", "BibTeX": "@article{37021189, title={The EffecTs of Amlodipine and other Blood PREssure Lowering Agents on Microvascular FuncTion in Small Vessel Diseases (TREAT-SVDs) trial: Study protocol for a randomised crossover trial}, author={Kopczak A and S Stringer M and van den Brink H and Kerkhofs D and W Blair G and van Dinther M and Onkenhout L and A Wartolowska K and Thrippleton MJ and Duering M and Staals J and Middeke M and André E and Norrving B and Bousser MG and Mansmann U and Rothwell PM and N Doubal F and van Oostenbrugge R and Jan Biessels G and Webb AJ and Wardlaw JM and Dichgans M}, journal={Eur Stroke J}, volume={8}, number={1}, pages={387-397}}"}}]}