{"count": 1, "results": [{"_id": "33606663", "pmid": 33606663, "title": "Differences between transient neonatal diabetes mellitus subtypes can guide diagnosis and therapy.", "journal": "Eur J Endocrinol", "authors": ["Bonfanti R", "Iafusco D", "Rabbone I", "Diedenhofen G", "Bizzarri C", "Patera PI", "Reinstadler P", "Costantino F", "Calcaterra V", "Iughetti L", "Savastio S", "Favia A", "Cardella F", "Lo Presti D", "Girtler Y", "Rabbiosi S", "D'Annunzio G", "Zanfardino A", "Piscopo A", "Casaburo F", "Pintomalli L", "Russo L", "Grasso V", "Minuto N", "Mucciolo M", "Novelli A", "Marucci A", "Piccini B", "Toni S", "Silvestri F", "Carrera P", "Rigamonti A", "Frontino G", "Trada M", "Tinti D", "Delvecchio M", "Rapini N", "Schiaffini R", "Mammì C", "Barbetti F", "Diabetes Study Group of ISPED"], "date": "2021-04-01T00:00:00Z", "doi": "10.1530/EJE-20-1030", "meta_date_publication": "2021 Apr", "meta_volume": "184", "meta_issue": "4", "meta_pages": "575-585", "score": 50240.72, "text_hl": "CONCLUSIONS: If @DISEASE_Diabetes_Mellitus_Transient_Neonatal_1 @DISEASE_MESH:C563322 @@@TNDM@@@ is suspected, KATP genes should be analyzed first with the exception of @SPECIES_9606 @@@patients@@@ with @<m>DISEASE_Macroglossia</m> @DISEASE_MESH:D008260 @@@macroglossia@@@ and/or @DISEASE_Hernia_Umbilical @DISEASE_MESH:D006554 @@@umbilical hernia@@@. ", "citations": {"NLM": "Bonfanti R, Iafusco D, Rabbone I, Diedenhofen G, Bizzarri C, Patera PI, Reinstadler P, Costantino F, Calcaterra V, Iughetti L, Savastio S, Favia A, Cardella F, Lo Presti D, Girtler Y, Rabbiosi S, D'Annunzio G, Zanfardino A, Piscopo A, Casaburo F, Pintomalli L, Russo L, Grasso V, Minuto N, Mucciolo M, Novelli A, Marucci A, Piccini B, Toni S, Silvestri F, Carrera P, Rigamonti A, Frontino G, Trada M, Tinti D, Delvecchio M, Rapini N, Schiaffini R, Mammì C, Barbetti F, Diabetes Study Group of ISPED. Differences between transient neonatal diabetes mellitus subtypes can guide diagnosis and therapy. Eur J Endocrinol. 2021 Apr;184(4):575-585. PMID: 33606663", "BibTeX": "@article{33606663, title={Differences between transient neonatal diabetes mellitus subtypes can guide diagnosis and therapy.}, author={Bonfanti R and Iafusco D and Rabbone I and Diedenhofen G and Bizzarri C and Patera PI and Reinstadler P and Costantino F and Calcaterra V and Iughetti L and Savastio S and Favia A and Cardella F and Lo Presti D and Girtler Y and Rabbiosi S and D'Annunzio G and Zanfardino A and Piscopo A and Casaburo F and Pintomalli L and Russo L and Grasso V and Minuto N and Mucciolo M and Novelli A and Marucci A and Piccini B and Toni S and Silvestri F and Carrera P and Rigamonti A and Frontino G and Trada M and Tinti D and Delvecchio M and Rapini N and Schiaffini R and Mammì C and Barbetti F and Diabetes Study Group of ISPED}, journal={Eur J Endocrinol}, volume={184}, number={4}, pages={575-585}}"}}]}