{"count": 1, "results": [{"_id": "34874747", "pmid": 34874747, "title": "An International Multicenter Cohort Study on beta-Blockers for the Treatment of Symptomatic Children With Catecholaminergic Polymorphic Ventricular Tachycardia.", "journal": "Circulation", "authors": ["Peltenburg PJ", "Kallas D", "Bos JM", "Lieve KVV", "Franciosi S", "Roston TM", "Denjoy I", "Sorensen KB", "Ohno S", "Roses-Noguer F", "Aiba T", "Maltret A", "LaPage MJ", "Atallah J", "Giudicessi JR", "Clur SB", "Blom NA", "Tanck M", "Extramiana F", "Kato K", "Barc J", "Borggrefe M", "Behr ER", "Sarquella-Brugada G", "Tfelt-Hansen J", "Zorio E", "Swan H", "Kammeraad JAE", "Krahn AD", "Davis A", "Sacher F", "Schwartz PJ", "Roberts JD", "Skinner JR", "van den Berg MP", "Kannankeril PJ", "Drago F", "Robyns T", "Haugaa K", "Tavacova T", "Semsarian C", "Till J", "Probst V", "Brugada R", "Shimizu W", "Horie M", "Leenhardt A", "Ackerman MJ", "Sanatani S", "van der Werf C", "Wilde AAM"], "date": "2022-02-01T00:00:00Z", "doi": "10.1161/CIRCULATIONAHA.121.056018", "meta_date_publication": "2022 Feb", "meta_volume": "145", "meta_issue": "5", "meta_pages": "333-344", "score": 50268.742, "text_hl": "The HR of the secondary outcome was only higher in @<m>CHEMICAL_Atenolol</m> @CHEMICAL_MESH:D001262 @@@atenolol@@@ compared with @CHEMICAL_Nadolol @CHEMICAL_MESH:D009248 @@@nadolol@@@ (HR, 2.68 [95% CI, 1.30-5.55]). ", "citations": {"NLM": "Peltenburg PJ, Kallas D, Bos JM, Lieve KVV, Franciosi S, Roston TM, Denjoy I, Sorensen KB, Ohno S, Roses-Noguer F, Aiba T, Maltret A, LaPage MJ, Atallah J, Giudicessi JR, Clur SB, Blom NA, Tanck M, Extramiana F, Kato K, Barc J, Borggrefe M, Behr ER, Sarquella-Brugada G, Tfelt-Hansen J, Zorio E, Swan H, Kammeraad JAE, Krahn AD, Davis A, Sacher F, Schwartz PJ, Roberts JD, Skinner JR, van den Berg MP, Kannankeril PJ, Drago F, Robyns T, Haugaa K, Tavacova T, Semsarian C, Till J, Probst V, Brugada R, Shimizu W, Horie M, Leenhardt A, Ackerman MJ, Sanatani S, van der Werf C, Wilde AAM. An International Multicenter Cohort Study on beta-Blockers for the Treatment of Symptomatic Children With Catecholaminergic Polymorphic Ventricular Tachycardia. Circulation. 2022 Feb;145(5):333-344. PMID: 34874747", "BibTeX": "@article{34874747, title={An International Multicenter Cohort Study on beta-Blockers for the Treatment of Symptomatic Children With Catecholaminergic Polymorphic Ventricular Tachycardia.}, author={Peltenburg PJ and Kallas D and Bos JM and Lieve KVV and Franciosi S and Roston TM and Denjoy I and Sorensen KB and Ohno S and Roses-Noguer F and Aiba T and Maltret A and LaPage MJ and Atallah J and Giudicessi JR and Clur SB and Blom NA and Tanck M and Extramiana F and Kato K and Barc J and Borggrefe M and Behr ER and Sarquella-Brugada G and Tfelt-Hansen J and Zorio E and Swan H and Kammeraad JAE and Krahn AD and Davis A and Sacher F and Schwartz PJ and Roberts JD and Skinner JR and van den Berg MP and Kannankeril PJ and Drago F and Robyns T and Haugaa K and Tavacova T and Semsarian C and Till J and Probst V and Brugada R and Shimizu W and Horie M and Leenhardt A and Ackerman MJ and Sanatani S and van der Werf C and Wilde AAM}, journal={Circulation}, volume={145}, number={5}, pages={333-344}}"}}]}