{"count": 2, "results": [{"_id": "34033525", "pmid": 34033525, "title": "Metformin: Experimental and Clinical Evidence for a Potential Role in Emphysema Treatment.", "journal": "Am J Respir Crit Care Med", "authors": ["Polverino F", "Wu TD", "Rojas-Quintero J", "Wang X", "Mayo J", "Tomchaney M", "Tram J", "Packard S", "Zhang D", "Cleveland KH", "Cordoba-Lanus E", "Owen CA", "Fawzy A", "Kinney GL", "Hersh CP", "Hansel NN", "Doubleday K", "Sauler M", "Tesfaigzi Y", "Ledford JG", "Casanova C", "Zmijewski J", "Konhilas J", "Langlais PR", "Schnellmann R", "Rahman I", "McCormack M", "Celli B"], "date": "2021-09-15T00:00:00Z", "doi": "10.1164/rccm.202012-4510OC", "meta_date_publication": "2021 Sep 15", "meta_volume": "204", "meta_issue": "6", "meta_pages": "651-666", "score": 50253.508, "text_hl": "Objectives: We sought to investigate whether @<m>CHEMICAL_Metformin</m> @CHEMICAL_MESH:D008687 @@@metformin@@@ may ameliorate CS-induced pathologies of @<m>DISEASE_Emphysematous_Cholecystitis</m> @DISEASE_MESH:D041882 @@@emphysematous@@@ @DISEASE_Pulmonary_Disease_Chronic_Obstructive @DISEASE_MESH:D029424 @@@chronic obstructive pulmonary disease@@@ (@DISEASE_Pulmonary_Disease_Chronic_Obstructive @DISEASE_MESH:D029424 @@@COPD@@@). ", "citations": {"NLM": "Polverino F, Wu TD, Rojas-Quintero J, Wang X, Mayo J, Tomchaney M, Tram J, Packard S, Zhang D, Cleveland KH, Cordoba-Lanus E, Owen CA, Fawzy A, Kinney GL, Hersh CP, Hansel NN, Doubleday K, Sauler M, Tesfaigzi Y, Ledford JG, Casanova C, Zmijewski J, Konhilas J, Langlais PR, Schnellmann R, Rahman I, McCormack M, Celli B. Metformin: Experimental and Clinical Evidence for a Potential Role in Emphysema Treatment. Am J Respir Crit Care Med. 2021 Sep 15;204(6):651-666. PMID: 34033525", "BibTeX": "@article{34033525, title={Metformin: Experimental and Clinical Evidence for a Potential Role in Emphysema Treatment.}, author={Polverino F and Wu TD and Rojas-Quintero J and Wang X and Mayo J and Tomchaney M and Tram J and Packard S and Zhang D and Cleveland KH and Cordoba-Lanus E and Owen CA and Fawzy A and Kinney GL and Hersh CP and Hansel NN and Doubleday K and Sauler M and Tesfaigzi Y and Ledford JG and Casanova C and Zmijewski J and Konhilas J and Langlais PR and Schnellmann R and Rahman I and McCormack M and Celli B}, journal={Am J Respir Crit Care Med}, volume={204}, number={6}, pages={651-666}}"}}, {"_id": "28186975", "pmid": 28186975, "pmcid": "PMC5410241", "title": "AMP-activated protein kinase reduces inflammatory responses and cellular senescence in pulmonary emphysema", "journal": "Oncotarget", "authors": ["Cheng XY", "Li YY", "Huang C", "Li J", "Yao HW"], "date": "2017-04-04T00:00:00Z", "doi": "10.18632/oncotarget.15116", "meta_date_publication": "2017 Apr 4", "meta_volume": "8", "meta_issue": "14", "meta_pages": "22513-22523", "score": 50043.035, "text_hl": "Furthermore, @<m>CHEMICAL_Metformin</m> @CHEMICAL_MESH:D008687 @@@metformin@@@ prophylactically protected against but Compound C further reduced mitochondrial proteins @GENE_SOD2 @GENE_6648 @@@SOD2@@@ and @GENE_SIRT3 @GENE_23410 @@@SIRT3@@@ in @<m>DISEASE_Emphysematous_Cholecystitis</m> @DISEASE_MESH:D041882 @@@emphysematous lungs@@@. ", "citations": {"NLM": "Cheng XY, Li YY, Huang C, Li J, Yao HW. AMP-activated protein kinase reduces inflammatory responses and cellular senescence in pulmonary emphysema Oncotarget. 2017 Apr 4;8(14):22513-22523. PMID: 28186975", "BibTeX": "@article{28186975, title={AMP-activated protein kinase reduces inflammatory responses and cellular senescence in pulmonary emphysema}, author={Cheng XY and Li YY and Huang C and Li J and Yao HW}, journal={Oncotarget}, volume={8}, number={14}, pages={22513-22523}}"}}]}