{"count": 1, "results": [{"_id": "37888913", "pmid": 37888913, "pmcid": "PMC10755839", "title": "Simvastatin in Critically Ill Patients with Covid-19", "journal": "N Engl J Med", "authors": ["REMAP-CAP Investigators", "Hills TE", "Lorenzi E", "Berry LR", "Shyamsundar M", "Al-Beidh F", "Annane D", "Arabi Y", "Aryal D", "Au C", "Beane A", "Bhimani Z", "Bonten M", "Bradbury CA", "Brunkhorst FM", "Burrell A", "Buxton M", "Calfee CS", "Cecconi M", "Cheng AC", "Cove ME", "Detry MA", "Estcourt LJ", "Fitzgerald M", "Goligher EC", "Goossens H", "Green C", "Haniffa R", "Harrison DA", "Hashmi M", "Higgins AM", "Huang DT", "Ichihara N", "Jayakumar D", "Kruger PS", "Lamontagne F", "Lampro L", "Lawler PR", "Marshall JC", "Mason AJ", "McGlothlin A", "McGuinness S", "McQuilten ZK", "McVerry BJ", "Mouncey PR", "Murthy S", "Neal MD", "Nichol AD", "O'Kane CM", "Parke RL", "Parker JC", "Rabindrarajan E", "Reyes LF", "Rowan KM", "Saito H", "Santos M", "Saunders CT", "Seymour CW", "Shankar-Hari M", "Sinha P", "Thompson BT", "Turgeon AF", "Turner AM", "van de Veerdonk FV", "Weis S", "Young IS", "Zarychanski R", "Lewis RJ", "McArthur CJ", "Angus DC", "Berry SM", "Derde LPG", "Webb SA", "Gordon AC", "McAuley DF"], "date": "2023-10-25T00:00:00Z", "doi": "10.1056/NEJMoa2309995", "meta_date_publication": "2023 Oct 25", "meta_volume": "", "meta_issue": "", "meta_pages": "", "score": 50256.297, "text_hl": "We investigated the effect of the initiation of @<m>CHEMICAL_Simvastatin</m> @CHEMICAL_MESH:D019821 @@@simvastatin@@@ treatment on survival and organ support in hospitalized @SPECIES_9606 @@@patients@@@ with @DISEASE_COVID_19 @DISEASE_MESH:D000086382 @@@Covid-19@@@ not receiving statins at baseline in the Randomized, Embedded, Multifactorial Adaptive Platform Trial for @DISEASE_Communication_Disorders @DISEASE_MESH:D003147 @@@Community-Acquired Pneumonia@@@ (REMAP-@<m>DISEASE_115650</m> @DISEASE_OMIM:115650 @@@CAP@@@). ", "citations": {"NLM": "REMAP-CAP Investigators, Hills TE, Lorenzi E, Berry LR, Shyamsundar M, Al-Beidh F, Annane D, Arabi Y, Aryal D, Au C, Beane A, Bhimani Z, Bonten M, Bradbury CA, Brunkhorst FM, Burrell A, Buxton M, Calfee CS, Cecconi M, Cheng AC, Cove ME, Detry MA, Estcourt LJ, Fitzgerald M, Goligher EC, Goossens H, Green C, Haniffa R, Harrison DA, Hashmi M, Higgins AM, Huang DT, Ichihara N, Jayakumar D, Kruger PS, Lamontagne F, Lampro L, Lawler PR, Marshall JC, Mason AJ, McGlothlin A, McGuinness S, McQuilten ZK, McVerry BJ, Mouncey PR, Murthy S, Neal MD, Nichol AD, O'Kane CM, Parke RL, Parker JC, Rabindrarajan E, Reyes LF, Rowan KM, Saito H, Santos M, Saunders CT, Seymour CW, Shankar-Hari M, Sinha P, Thompson BT, Turgeon AF, Turner AM, van de Veerdonk FV, Weis S, Young IS, Zarychanski R, Lewis RJ, McArthur CJ, Angus DC, Berry SM, Derde LPG, Webb SA, Gordon AC, McAuley DF. Simvastatin in Critically Ill Patients with Covid-19 N Engl J Med. 2023 Oct 25;():. PMID: 37888913", "BibTeX": "@article{37888913, title={Simvastatin in Critically Ill Patients with Covid-19}, author={REMAP-CAP Investigators and Hills TE and Lorenzi E and Berry LR and Shyamsundar M and Al-Beidh F and Annane D and Arabi Y and Aryal D and Au C and Beane A and Bhimani Z and Bonten M and Bradbury CA and Brunkhorst FM and Burrell A and Buxton M and Calfee CS and Cecconi M and Cheng AC and Cove ME and Detry MA and Estcourt LJ and Fitzgerald M and Goligher EC and Goossens H and Green C and Haniffa R and Harrison DA and Hashmi M and Higgins AM and Huang DT and Ichihara N and Jayakumar D and Kruger PS and Lamontagne F and Lampro L and Lawler PR and Marshall JC and Mason AJ and McGlothlin A and McGuinness S and McQuilten ZK and McVerry BJ and Mouncey PR and Murthy S and Neal MD and Nichol AD and O'Kane CM and Parke RL and Parker JC and Rabindrarajan E and Reyes LF and Rowan KM and Saito H and Santos M and Saunders CT and Seymour CW and Shankar-Hari M and Sinha P and Thompson BT and Turgeon AF and Turner AM and van de Veerdonk FV and Weis S and Young IS and Zarychanski R and Lewis RJ and McArthur CJ and Angus DC and Berry SM and Derde LPG and Webb SA and Gordon AC and McAuley DF}, journal={N Engl J Med}}"}}]}