{"count": 2, "results": [{"_id": "33606663", "pmid": 33606663, "title": "Differences between transient neonatal diabetes mellitus subtypes can guide diagnosis and therapy.", "journal": "Eur J Endocrinol", "authors": ["Bonfanti R", "Iafusco D", "Rabbone I", "Diedenhofen G", "Bizzarri C", "Patera PI", "Reinstadler P", "Costantino F", "Calcaterra V", "Iughetti L", "Savastio S", "Favia A", "Cardella F", "Lo Presti D", "Girtler Y", "Rabbiosi S", "D'Annunzio G", "Zanfardino A", "Piscopo A", "Casaburo F", "Pintomalli L", "Russo L", "Grasso V", "Minuto N", "Mucciolo M", "Novelli A", "Marucci A", "Piccini B", "Toni S", "Silvestri F", "Carrera P", "Rigamonti A", "Frontino G", "Trada M", "Tinti D", "Delvecchio M", "Rapini N", "Schiaffini R", "Mammì C", "Barbetti F", "Diabetes Study Group of ISPED"], "date": "2021-04-01T00:00:00Z", "doi": "10.1530/EJE-20-1030", "meta_date_publication": "2021 Apr", "meta_volume": "184", "meta_issue": "4", "meta_pages": "575-585", "score": 50265.27, "text_hl": "Seven @DISEASE_Diabetes_Mellitus @DISEASE_MESH:D003920 @@@diabetic@@@ individuals with KATP mutations were successfully treated with @CHEMICAL_Sulfonylurea_Compounds @CHEMICAL_MESH:D013453 @@@sulfonylurea@@@ monotherapy; four cases with relapsing 6q24/@<m>DISEASE_Diabetes_Mellitus_Transient_Neonatal_1</m> @DISEASE_MESH:C563322 @@@TNDM@@@ were treated with @GENE_INS @GENE_3630 @@@insulin@@@, @<m>CHEMICAL_Metformin</m> @CHEMICAL_MESH:D008687 @@@metformin@@@ or combination therapy. ", "citations": {"NLM": "Bonfanti R, Iafusco D, Rabbone I, Diedenhofen G, Bizzarri C, Patera PI, Reinstadler P, Costantino F, Calcaterra V, Iughetti L, Savastio S, Favia A, Cardella F, Lo Presti D, Girtler Y, Rabbiosi S, D'Annunzio G, Zanfardino A, Piscopo A, Casaburo F, Pintomalli L, Russo L, Grasso V, Minuto N, Mucciolo M, Novelli A, Marucci A, Piccini B, Toni S, Silvestri F, Carrera P, Rigamonti A, Frontino G, Trada M, Tinti D, Delvecchio M, Rapini N, Schiaffini R, Mammì C, Barbetti F, Diabetes Study Group of ISPED. Differences between transient neonatal diabetes mellitus subtypes can guide diagnosis and therapy. Eur J Endocrinol. 2021 Apr;184(4):575-585. PMID: 33606663", "BibTeX": "@article{33606663, title={Differences between transient neonatal diabetes mellitus subtypes can guide diagnosis and therapy.}, author={Bonfanti R and Iafusco D and Rabbone I and Diedenhofen G and Bizzarri C and Patera PI and Reinstadler P and Costantino F and Calcaterra V and Iughetti L and Savastio S and Favia A and Cardella F and Lo Presti D and Girtler Y and Rabbiosi S and D'Annunzio G and Zanfardino A and Piscopo A and Casaburo F and Pintomalli L and Russo L and Grasso V and Minuto N and Mucciolo M and Novelli A and Marucci A and Piccini B and Toni S and Silvestri F and Carrera P and Rigamonti A and Frontino G and Trada M and Tinti D and Delvecchio M and Rapini N and Schiaffini R and Mammì C and Barbetti F and Diabetes Study Group of ISPED}, journal={Eur J Endocrinol}, volume={184}, number={4}, pages={575-585}}"}}, {"_id": "33088017", "pmid": 33088017, "pmcid": "PMC7534527", "title": "Relapsing 6q24-related transient neonatal diabetes mellitus with insulin resistance: A case report", "journal": "Clin Pediatr Endocrinol", "authors": ["Uchida N", "Ohnishi T", "Kojima T", "Takahashi T", "Makita Y", "Fukami M", "Shibata H", "Hasegawa T", "Ishii T"], "date": "2020-01-01T00:00:00Z", "doi": "10.1297/cpe.29.179", "meta_date_publication": "2020", "meta_volume": "29", "meta_issue": "4", "meta_pages": "179-182", "score": 50262.387, "text_hl": "These results suggest that @<m>CHEMICAL_Metformin</m> @CHEMICAL_MESH:D008687 @@@metformin@@@ could be a treatment option for 6q24-@<m>DISEASE_Diabetes_Mellitus_Transient_Neonatal_1</m> @DISEASE_MESH:C563322 @@@TNDM@@@ with @DISEASE_Insulin_Resistance @DISEASE_MESH:D007333 @@@insulin resistance@@@. ", "citations": {"NLM": "Uchida N, Ohnishi T, Kojima T, Takahashi T, Makita Y, Fukami M, Shibata H, Hasegawa T, Ishii T. Relapsing 6q24-related transient neonatal diabetes mellitus with insulin resistance: A case report Clin Pediatr Endocrinol. 2020;29(4):179-182. PMID: 33088017", "BibTeX": "@article{33088017, title={Relapsing 6q24-related transient neonatal diabetes mellitus with insulin resistance: A case report}, author={Uchida N and Ohnishi T and Kojima T and Takahashi T and Makita Y and Fukami M and Shibata H and Hasegawa T and Ishii T}, journal={Clin Pediatr Endocrinol}, volume={29}, number={4}, pages={179-182}}"}}]}