{"count": 2, "results": [{"_id": "36719431", "pmid": 36719431, "title": "CELLULAR SENESCENCE IMPLICATED IN SEPSIS-INDUCED MUSCLE WEAKNESS AND AMELIORATED WITH METFORMIN.", "journal": "Shock", "authors": ["Chen J", "Chen XY", "Cong XX", "Wang S", "Xu SB", "Sun YT", "Zhou YT", "Zheng LL", "Huang M"], "date": "2023-04-01T00:00:00Z", "doi": "10.1097/SHK.0000000000002086", "meta_date_publication": "2023 Apr 1", "meta_volume": "59", "meta_issue": "4", "meta_pages": "646-656", "score": 50272.668, "text_hl": "@<m>DISEASE_Ependymoma</m> @DISEASE_MESH:D004806 @@@CELLULAR SENESCENCE IMPLICATED@@@ IN @DISEASE_Sepsis @DISEASE_MESH:D018805 @@@SEPSIS-INDUCED MUSCLE@@@ WEAKNESS AND AMELIORATED WITH @<m>CHEMICAL_Metformin</m> @CHEMICAL_MESH:D008687 @@@METFORMIN@@@.", "citations": {"NLM": "Chen J, Chen XY, Cong XX, Wang S, Xu SB, Sun YT, Zhou YT, Zheng LL, Huang M. CELLULAR SENESCENCE IMPLICATED IN SEPSIS-INDUCED MUSCLE WEAKNESS AND AMELIORATED WITH METFORMIN. Shock. 2023 Apr 1;59(4):646-656. PMID: 36719431", "BibTeX": "@article{36719431, title={CELLULAR SENESCENCE IMPLICATED IN SEPSIS-INDUCED MUSCLE WEAKNESS AND AMELIORATED WITH METFORMIN.}, author={Chen J and Chen XY and Cong XX and Wang S and Xu SB and Sun YT and Zhou YT and Zheng LL and Huang M}, journal={Shock}, volume={59}, number={4}, pages={646-656}}"}}, {"_id": "34613815", "pmid": 34613815, "title": "Targeting integrated epigenetic and metabolic pathways in lethal childhood PFA ependymomas.", "journal": "Sci Transl Med", "authors": ["Panwalkar P", "Tamrazi B", "Dang D", "Chung C", "Sweha S", "Natarajan SK", "Pun M", "Bayliss J", "Ogrodzinski MP", "Pratt D", "Mullan B", "Hawes D", "Yang F", "Lu C", "Sabari BR", "Achreja A", "Heon J", "Animasahun O", "Cieslik M", "Dunham C", "Yip S", "Hukin J", "Phillips JJ", "Bornhorst M", "Griesinger AM", "Donson AM", "Foreman NK", "Garton HJL", "Heth J", "Muraszko K", "Nazarian J", "Koschmann C", "Jiang L", "Filbin MG", "Nagrath D", "Kool M", "Korshunov A", "Pfister SM", "Gilbertson RJ", "Allis CD", "Chinnaiyan AM", "Lunt SY", "Blüml S", "Judkins AR", "Venneti S"], "date": "2021-10-06T00:00:00Z", "doi": "10.1126/scitranslmed.abc0497", "meta_date_publication": "2021 Oct 6", "meta_volume": "13", "meta_issue": "614", "meta_pages": "eabc0497", "score": 50265.113, "text_hl": "Repurposing the antidiabetic drug @<m>CHEMICAL_Metformin</m> @CHEMICAL_MESH:D008687 @@@metformin@@@ lowered pathogenic EZHIP, increased H3K27me3, and suppressed @DISEASE_Neoplasms @DISEASE_MESH:D009369 @@@tumor@@@ growth, suggesting that targeting integrated metabolic/epigenetic pathways is a potential therapeutic strategy for treating childhood @<m>DISEASE_Ependymoma</m> @DISEASE_MESH:D004806 @@@ependymomas@@@.", "citations": {"NLM": "Panwalkar P, Tamrazi B, Dang D, Chung C, Sweha S, Natarajan SK, Pun M, Bayliss J, Ogrodzinski MP, Pratt D, Mullan B, Hawes D, Yang F, Lu C, Sabari BR, Achreja A, Heon J, Animasahun O, Cieslik M, Dunham C, Yip S, Hukin J, Phillips JJ, Bornhorst M, Griesinger AM, Donson AM, Foreman NK, Garton HJL, Heth J, Muraszko K, Nazarian J, Koschmann C, Jiang L, Filbin MG, Nagrath D, Kool M, Korshunov A, Pfister SM, Gilbertson RJ, Allis CD, Chinnaiyan AM, Lunt SY, Blüml S, Judkins AR, Venneti S. Targeting integrated epigenetic and metabolic pathways in lethal childhood PFA ependymomas. Sci Transl Med. 2021 Oct 6;13(614):eabc0497. PMID: 34613815", "BibTeX": "@article{34613815, title={Targeting integrated epigenetic and metabolic pathways in lethal childhood PFA ependymomas.}, author={Panwalkar P and Tamrazi B and Dang D and Chung C and Sweha S and Natarajan SK and Pun M and Bayliss J and Ogrodzinski MP and Pratt D and Mullan B and Hawes D and Yang F and Lu C and Sabari BR and Achreja A and Heon J and Animasahun O and Cieslik M and Dunham C and Yip S and Hukin J and Phillips JJ and Bornhorst M and Griesinger AM and Donson AM and Foreman NK and Garton HJL and Heth J and Muraszko K and Nazarian J and Koschmann C and Jiang L and Filbin MG and Nagrath D and Kool M and Korshunov A and Pfister SM and Gilbertson RJ and Allis CD and Chinnaiyan AM and Lunt SY and Blüml S and Judkins AR and Venneti S}, journal={Sci Transl Med}, volume={13}, number={614}, pages={eabc0497}}"}}]}